"ID"	"feed"	"time"	"text1"	"text2"	"TAG"	"Nb_tag_detected"
3395142	"en_CHN_mopost_int"	"2014-10-24 07:24:21"	"Grace shakes up Mugabe succession battle in Zimbabwe"	"Zimbabwe’s ruling party could be heading for a devastating split as bickering between rival factions jostling to succeed ageing ruler Robert Mugabe escalates ahead of a key congress."	"ZWE"	1
3396318	"en_CHN_mopost_int"	"2014-10-24 09:43:20"	"What led gunman to go on Canada shooting rampage? Family and friends offer clues"	"The gunman who killed a soldier in Ottawa and then raced through Canada’s parliament before being shot dead was a misfit and perhaps mentally ill, according to police, friends and family. His troubled and transient past included robbery and drug offences."	"CAN"	2
3396668	"en_CHN_mopost_int"	"2014-10-24 10:24:25"	"Sweden calls off search for mystery submarine"	"Swedish authorities say they have called off their week-long search for a suspected submarine in the Stockholm archipelago."	"SWE"	3
3397258	"en_CHN_mopost_int"	"2014-10-24 11:24:27"	"Poland’s ex-PM Tusk denies claim he and Putin agreed to partition Ukraine"	"Poland’s former prime minister, Donald Tusk, denied on Friday that Russian President Vladimir Putin suggested that their two nations carve up Ukraine."	"POL"	1
3397258	"en_CHN_mopost_int"	"2014-10-24 11:24:27"	"Poland’s ex-PM Tusk denies claim he and Putin agreed to partition Ukraine"	"Poland’s former prime minister, Donald Tusk, denied on Friday that Russian President Vladimir Putin suggested that their two nations carve up Ukraine."	"RUS"	2
3397258	"en_CHN_mopost_int"	"2014-10-24 11:24:27"	"Poland’s ex-PM Tusk denies claim he and Putin agreed to partition Ukraine"	"Poland’s former prime minister, Donald Tusk, denied on Friday that Russian President Vladimir Putin suggested that their two nations carve up Ukraine."	"UKR"	1
3398611	"en_CHN_mopost_int"	"2014-10-24 13:24:30"	"Cameron interupts EU summit to call for crisis talks over cash demand"	"British Prime Minister David Cameron interrupted an EU summit on Friday to demand an emergency finance ministers meeting over a demand from Brussels for an extra 2.1 billion euros from London, sources said."	"BEL"	1
3398611	"en_CHN_mopost_int"	"2014-10-24 13:24:30"	"Cameron interupts EU summit to call for crisis talks over cash demand"	"British Prime Minister David Cameron interrupted an EU summit on Friday to demand an emergency finance ministers meeting over a demand from Brussels for an extra 2.1 billion euros from London, sources said."	"GBR"	3
3400636	"en_CHN_mopost_int"	"2014-10-24 16:24:34"	"Francisco Nicolas Gomez Iglesias cons Spanish elite from the king down"	"Police in Spain have arrested an alleged con man, aged 20, who embarrassed the establishment by posing as a VIP and even had himself photographed shaking hands with the king."	"ESP"	2
3400637	"en_CHN_mopost_int"	"2014-10-24 16:24:34"	"British war hero ‘Jack King’ revealed as bank clerk Eric Arthur Roberts"	"Hans Kohout had a plan, according to secret documents released yesterday. At the height of the second world war, the naturalised British citizen wanted to give the Nazis advance word of a top secret British tactic that could neutralise an enemy's air defences, leaving major cities exposed to devastating air raids."	"GBR"	1
3400638	"en_CHN_mopost_int"	"2014-10-24 16:24:34"	"Canada killings followed advice from al-Qaeda and Islamic State jihadist guidebook"	"While they may not have officially been designated as jihadists, two suspected extremists who killed Canadian soldiers in shooting and driving rampages followed instructions issued by al-Qaeda and the Islamic State group to the letter."	"CAN"	2
3400639	"en_CHN_mopost_int"	"2014-10-24 16:24:34"	"Passport delay seen as trigger for attack on Canadian parliament"	"Government leaders gathered in a show of resolution a day after a deadly attack on Canada's parliament, as authorities and citizens sifted through confounding shards of the gunman's life seeking to understand what motivated the man to storm the nation's seat of power."	"CAN"	2
3400640	"en_CHN_mopost_int"	"2014-10-24 16:24:34"	"Tunisia rocked by ‘terrorist’ gunfight ahead of national elections"	"Women and children were caught up in a police siege near the Tunisian capital yesterday, with ""terrorists"" killing one officer in a gunfight, ahead of elections that have sparked fears of jihadist attacks."	"TUN"	2
3400876	"en_CHN_mopost_int"	"2014-10-24 16:43:33"	"Facebook’s new Rooms app allows users to be anyone they wish to be"	"Facebook has released an application that lets people create virtual ""rooms"" to chat about whatever they wish using any name they would like."	""	NA
3400877	"en_CHN_mopost_int"	"2014-10-24 16:43:33"	"Ice Age people lived high in the Andes 12,400 years ago"	"Ice Age people were able to survive at high elevations in the Peruvian Andes 12,400 years ago, almost a millennium earlier than previously thought, researchers have said."	"PER"	1
3400878	"en_CHN_mopost_int"	"2014-10-24 16:43:33"	"Swedish officials say ‘at least one’ foreign vessel was in its waters"	"Swedish officials said yesterday that it appeared that at least one foreign vessel probably had operated in waters near its capital in recent days, calling such activity ""unacceptable""."	"SWE"	1
3400879	"en_CHN_mopost_int"	"2014-10-24 16:43:33"	"Scammers cash in on fake Ebola cures"	"If you were looking for another reason to indulge in dark chocolate, a so-called natural health website recently offered one: It claimed the tasty treat can alleviate the excruciating symptoms of Ebola."	""	NA
3400880	"en_CHN_mopost_int"	"2014-10-24 16:43:33"	"Hatchet-wielding man shot by New York police"	"New York police shot and killed a hatchet-wielding man on Thursday after he suddenly attacked a group of officers without warning in broad daylight on a busy commercial district in Queens."	"USA"	1
3400881	"en_CHN_mopost_int"	"2014-10-24 16:43:33"	"Group sealed in dome as Nasa’ tests mental stress of a mission on Mars"	"Six people have sealed themselves inside a white vinyl dome in Hawaii to embark on an eight-month test of how their mental health might fare during a mission to Mars."	"USA"	1
3400882	"en_CHN_mopost_int"	"2014-10-24 16:43:33"	"Brazil’s president Dilma Rousseff winning the internet election battle"	"Dishing out advice to pop star Beyonce and chatting about reality TV, Dilma Rousseff's flippant online alter-ego is worlds apart from the Brazilian president's image as a stern task-master."	"BRA"	3
3404474	"en_CHN_mopost_int"	"2014-10-24 22:24:51"	"Iraqi forces 'months away' from major offensive against Islamic State"	"Iraqi forces are months away from waging a sustained ground offensive against Islamic State - and any similar effort in Syria will take longer, US military officials have revealed."	"IRQ"	1
3404474	"en_CHN_mopost_int"	"2014-10-24 22:24:51"	"Iraqi forces 'months away' from major offensive against Islamic State"	"Iraqi forces are months away from waging a sustained ground offensive against Islamic State - and any similar effort in Syria will take longer, US military officials have revealed."	"SYR"	1
3404474	"en_CHN_mopost_int"	"2014-10-24 22:24:51"	"Iraqi forces 'months away' from major offensive against Islamic State"	"Iraqi forces are months away from waging a sustained ground offensive against Islamic State - and any similar effort in Syria will take longer, US military officials have revealed."	"USA"	1
3404655	"en_CHN_mopost_int"	"2014-10-24 22:43:49"	"David Cameron livid at €2b surprise bill from Brussels"	"David Cameron furiously rejected a surprise demand from Brussels for more than €2 billion (HK$19.6 billion) in backdated charges, setting up a new showdown over Britain's place in the EU."	"BEL"	1
3404655	"en_CHN_mopost_int"	"2014-10-24 22:43:49"	"David Cameron livid at €2b surprise bill from Brussels"	"David Cameron furiously rejected a surprise demand from Brussels for more than €2 billion (HK$19.6 billion) in backdated charges, setting up a new showdown over Britain's place in the EU."	"GBR"	2
3404985	"en_CHN_mopost_int"	"2014-10-24 23:24:52"	"Canadians showed quiet kind of courage in face of Ottawa attacks"	"You can tell a lot about a nation and its people by how they respond to a crisis. Canada is often perceived as somewhat unexciting. Canadians tend to be low-key and rarely boastful."	"CAN"	3
3404986	"en_CHN_mopost_int"	"2014-10-24 23:24:52"	"Russian President Vladimir Putin says US is trying to 'remake the whole world'"	"Russian President Vladimir Putin has lashed out at the US accusing the country of endangering global security by imposing a ""unilateral diktat"" on the rest of the world."	"RUS"	2
3404986	"en_CHN_mopost_int"	"2014-10-24 23:24:52"	"Russian President Vladimir Putin says US is trying to 'remake the whole world'"	"Russian President Vladimir Putin has lashed out at the US accusing the country of endangering global security by imposing a ""unilateral diktat"" on the rest of the world."	"USA"	1
3404987	"en_CHN_mopost_int"	"2014-10-24 23:24:52"	"'Kidnapped' brain tumour patient Ashya King finishes proton therapy"	"Five-year-old British brain tumour patient Ashya King is feeling better after 30 sessions of proton therapy in Prague and is heading back to Spain."	"CZE"	1
3404987	"en_CHN_mopost_int"	"2014-10-24 23:24:52"	"'Kidnapped' brain tumour patient Ashya King finishes proton therapy"	"Five-year-old British brain tumour patient Ashya King is feeling better after 30 sessions of proton therapy in Prague and is heading back to Spain."	"ESP"	1
3404987	"en_CHN_mopost_int"	"2014-10-24 23:24:52"	"'Kidnapped' brain tumour patient Ashya King finishes proton therapy"	"Five-year-old British brain tumour patient Ashya King is feeling better after 30 sessions of proton therapy in Prague and is heading back to Spain."	"GBR"	1
3404988	"en_CHN_mopost_int"	"2014-10-24 23:24:52"	"Nobel prize winner tops his own idea with newer, better microscope"	"Earlier this month Eric Betzig shared the Nobel Prize in chemistry for his work on high-resolution microscopes - specifically the one he designed and built on a friend's living room floor."	""	NA
3404989	"en_CHN_mopost_int"	"2014-10-24 23:24:52"	"Islamic State militants behind chemical attacks on Iraqi police"	"Dizzy, vomiting and struggling to breathe, 11 Iraqi police officers were rushed to a government hospital 80km north of the capital last month."	"IRQ"	1
3406675	"en_CHN_mopost_int"	"2014-10-25 03:44:03"	"US student 'stared at victims' faces' as he opened fire at high school before committing suicide"	"A student walked into his Seattle-area high school cafeteria on Friday and without saying a word opened fire, killing one person and shooting several others in the head before turning the gun on himself."	"USA"	2
3407863	"en_CHN_mopost_int"	"2014-10-25 07:44:09"	"Google executive makes historic 42,000-metre skydive from the edge of space"	"Wearing his specially designed spacesuit, Alan Eustace hit a top velocity of 1,322 km/h during a freefall that lasted four and a half minutes."	""	NA
3408441	"en_CHN_mopost_int"	"2014-10-25 09:25:10"	"“We won’t pay,” furious Cameron tells EU over surprise 2.1-billion-euro bill"	"In a vivid display of fury at European Union technocrats, British Prime Minister David Cameron refused to pay a surprise 2.1-billion-euro bill on Friday as EU leaders ordered an urgent review of the calculations used."	"GBR"	2
3408784	"en_CHN_mopost_int"	"2014-10-25 10:25:12"	"Mali records first Ebola case as 2-year-old girl dies: officials"	"A two-year-old girl who was Mali’s first case of Ebola died on Friday, shortly after the World Health Organisation warned that many people had potentially been exposed to the virus because she was taken across the country while ill."	"MLI"	1
3408785	"en_CHN_mopost_int"	"2014-10-25 10:25:12"	"American nurse is declared free from Ebola; gets a hug from Obama"	"Two American nurses were declared cured of Ebola on Friday, and one was healthy enough to leave hospital and meet President Barack Obama."	"USA"	2
3409118	"en_CHN_mopost_int"	"2014-10-25 11:25:13"	"Italian court quashes Dolce and Gabbana fraud convictions"	"The Italian Supreme Court on Friday overturned fraud convictions and 18-month jail terms given to celebrated fashion duo Domenico Dolce and Stefano Gabbana, their company announced."	"ITA"	1
3409573	"en_CHN_mopost_int"	"2014-10-25 12:25:14"	"Emergency rule declared in Egypt’s Sinai Peninsula after bomb kills 30 troops"	"A state of emergency came into force on Saturday across much of Egypt’s Sinai Peninsula after 30 soldiers were killed in a suicide car bombing by suspected jihadists."	"EGY"	1
3410960	"en_CHN_mopost_int"	"2014-10-25 16:25:20"	"Protesters top one million at Rome anti-employment reform rally: organisers"	"Some one million Italians took to the streets of Rome on Saturday for a demonstration organised by Italy’s largest trade union to protest against Prime Minister Matteo Renzi’s plans to overhaul the labour market."	"ITA"	5
3413311	"en_CHN_mopost_int"	"2014-10-25 22:25:29"	"Emergency rule declared in Egypt's Sinai Peninsula after bomb kills 30 troops"	"A state of emergency came into force yesterday across parts of Egypt's Sinai Peninsula as the military pounded suspected jihadists after 30 soldiers were killed in a suicide car bombing."	"EGY"	1
3414269	"en_CHN_mopost_int"	"2014-10-26 01:25:33"	"Candidates in Tunisian poll vow to stay true to Arab spring"	"The audience packed into a hotel in the Mediterranean port town of Bizerte last week was in a festive mood as it waited to hear veteran politician and lawyer Beji Caid el Sebsi speak."	"TUN"	1
3414270	"en_CHN_mopost_int"	"2014-10-26 01:25:33"	"New York axe attack on police was a terrorist act, commissioner says"	"A hatchet attack on New York police officers was a ""terrorist act"" carried out by a self-radicalised Muslim convert who had been in the military and browsed al-Qaeda websites, police said."	"USA"	1
3414271	"en_CHN_mopost_int"	"2014-10-26 01:25:33"	"Iran hangs woman for murder despite international pressure to spare her"	"A 26-year-old Iranian woman convicted of murdering a man she accused of trying to rape her as a teenager was hanged, the official news agency IRNA said, despite international pleas for her life to be spared."	"IRN"	2
3414272	"en_CHN_mopost_int"	"2014-10-26 01:25:33"	"Bassist and songwriter Jack Bruce, who shot to fame as Cream front man, dies"	"British musician Jack Bruce, best known as the bassist from the 1960s group Cream, has died. He was 71."	"GBR"	1
3414273	"en_CHN_mopost_int"	"2014-10-26 01:25:33"	"Benazir's son puts Bhutto name back in spotlight"	"The scion of Pakistan's leading political dynasty, emerging from the shadow of his mother, former prime minister Benazir Bhutto, seven years after she was assassinated, has vowed to resurrect her party's flagging fortunes."	"PAK"	1
3414274	"en_CHN_mopost_int"	"2014-10-26 01:25:33"	"New Jersey quarantines health worker in Ebola precaution"	"A medical worker quarantined in the US state of New Jersey after returning from treating Ebola victims in West Africa was being evaluated in a hospital isolation ward after new contagion-control safeguards were imposed."	"USA"	1
3414373	"en_CHN_mopost_int"	"2014-10-26 01:44:46"	"New Yorkers worried after doctor back from Africa found with Ebola fever"	"News of New York's first case of Ebola fever was met with worry and even anger, but for the city of eight million residents, seasoned by everything from terror attacks to superstorms, there was little sign of panic."	"USA"	1
3414774	"en_CHN_mopost_int"	"2014-10-26 02:25:35"	"US to recognise same-sex marriage in 6 more states"	"The federal government is recognising gay marriage in six more states and extending federal benefits to those couples, Attorney General Eric Holder announced Saturday."	"USA"	1
3414854	"en_CHN_mopost_int"	"2014-10-26 02:44:59"	"War-scarred Ukraine votes for pro-Western future"	"War-weary Ukrainians vote Sunday for a powerful new parliament in which a likely alliance of pro-Western and nationalist forces will confirm the ex-Soviet country’s historic but bloody break from Russia’s domain."	"RUS"	1
3414854	"en_CHN_mopost_int"	"2014-10-26 02:44:59"	"War-scarred Ukraine votes for pro-Western future"	"War-weary Ukrainians vote Sunday for a powerful new parliament in which a likely alliance of pro-Western and nationalist forces will confirm the ex-Soviet country’s historic but bloody break from Russia’s domain."	"UKR"	2
3415058	"en_CHN_mopost_int"	"2014-10-26 03:45:02"	"Nurse ‘made to feel like a criminal’ after returning to US following stint treating Ebola patients"	"An American nurse published a scathing account Saturday of her treatment after being put in isolation in the United States following a stint caring for Ebola patients in West Africa, saying she was made to feel like “a criminal.”"	"USA"	3
3415516	"en_CHN_mopost_int"	"2014-10-26 05:25:42"	"Five-year-olds learn coding as Britain eyes digital future"	"“Miss! We made it breathe out fire!” exclaimed 10-year-old Joe, pointing at the laptop on his desk, where he has programmed his animated dragon to belch flames into the face of the Greek hero Heracles."	"GBR"	1
3415516	"en_CHN_mopost_int"	"2014-10-26 05:25:42"	"Five-year-olds learn coding as Britain eyes digital future"	"“Miss! We made it breathe out fire!” exclaimed 10-year-old Joe, pointing at the laptop on his desk, where he has programmed his animated dragon to belch flames into the face of the Greek hero Heracles."	"GRC"	1
3422529	"en_CHN_mopost_int"	"2014-10-26 22:45:33"	"14 teenage 'evil clowns' arrested in southern France as craze spreads"	"A wave of panic sparked by evil clowns stalking French towns has spread to the south of France where police arrested 14 teenagers dressed as the pranksters, carrying pistols, knives and baseball bats."	"FRA"	2
3422530	"en_CHN_mopost_int"	"2014-10-26 22:45:33"	"Leading Washington poll consultants take key posts for British election"	"The US invasion of British politics has been a long war of attrition. Each successive campaign since the 1990s increasingly has taken on the flavour of American electioneering."	"GBR"	1
3422530	"en_CHN_mopost_int"	"2014-10-26 22:45:33"	"Leading Washington poll consultants take key posts for British election"	"The US invasion of British politics has been a long war of attrition. Each successive campaign since the 1990s increasingly has taken on the flavour of American electioneering."	"USA"	3
3422531	"en_CHN_mopost_int"	"2014-10-26 22:45:33"	"Libya's remote southern desert a haven for jihadist training camps"	"Libya's remote desert south has become a haven for north African jihadis who have set up training camps in what has traditionally been a hotbed of arms smuggling."	"LBY"	1
3422532	"en_CHN_mopost_int"	"2014-10-26 22:45:33"	"US highway patrol officer shared nude photos of arrested women"	"A California traffic policeman suspected of stealing nude and racy photos from the mobile phones of women arrested on drink-driving charges sent the pictures to at least two fellow officers in what he called a game."	"USA"	2
3422533	"en_CHN_mopost_int"	"2014-10-26 22:45:33"	"Austrian drones set for surveillance mission in Ukraine"	"In the middle of the Austrian countryside, a few sleek, hi-tech drones sit in a bright production hall, ready for missions over Ukraine, the Mediterranean or the Middle East."	"AUT"	1
3422533	"en_CHN_mopost_int"	"2014-10-26 22:45:33"	"Austrian drones set for surveillance mission in Ukraine"	"In the middle of the Austrian countryside, a few sleek, hi-tech drones sit in a bright production hall, ready for missions over Ukraine, the Mediterranean or the Middle East."	"UKR"	1
3422534	"en_CHN_mopost_int"	"2014-10-26 22:45:33"	"New teacher hailed a hero in Washington state school gun rampage"	"A newly hired teacher who confronted a student with a gun has been hailed a hero after a deadly shooting rampage in the cafeteria of a Washington state high school."	"USA"	1
3422535	"en_CHN_mopost_int"	"2014-10-26 22:45:33"	"Polls forecast Republicans will win US Senate control in mid-term elections"	"Republicans appear increasingly likely to win back the US Senate in November 4 mid-term elections, a move that would pile misery on President Barack Obama in his final two years in office."	"USA"	2
3422536	"en_CHN_mopost_int"	"2014-10-26 22:45:33"	"Benito Mussolini's air raid shelter in Rome to be opened to the public"	"Benito Mussolini's personal air raid shelter is opening to the public, 74 years after Italy's former fascist dictator started building a network of fortified underground rooms to protect himself and his family from wartime bombing."	"ITA"	2
3422537	"en_CHN_mopost_int"	"2014-10-26 22:45:33"	"Belgian chocolate company decides ISIS is not a good trading name"	"The ravages of Islamic State have been among the dominant news stories of 2014, but before this year few were even aware of the organisation. Originally a splinter of al-Qaeda, it has shaken foreign governments in ways its parent never could."	"BEL"	1
3422538	"en_CHN_mopost_int"	"2014-10-26 22:45:33"	"US Marines, British troops end combat operations in Afghanistan"	"The last US Marines unit and final British combat troops in Afghanistan officially ended their operations yesterday as they packed up to leave the country and transferred a massive military base to the Afghan military."	"AFG"	2
3422538	"en_CHN_mopost_int"	"2014-10-26 22:45:33"	"US Marines, British troops end combat operations in Afghanistan"	"The last US Marines unit and final British combat troops in Afghanistan officially ended their operations yesterday as they packed up to leave the country and transferred a massive military base to the Afghan military."	"GBR"	1
3422538	"en_CHN_mopost_int"	"2014-10-26 22:45:33"	"US Marines, British troops end combat operations in Afghanistan"	"The last US Marines unit and final British combat troops in Afghanistan officially ended their operations yesterday as they packed up to leave the country and transferred a massive military base to the Afghan military."	"USA"	1
3424733	"en_CHN_mopost_int"	"2014-10-27 03:45:41"	"Dilma Rousseff narrowly wins re-election in Brazil with call to save social progress"	"Dilma Rousseff narrowly won re-election on Sunday after convincing voters that her party’s strong record of reducing poverty over the last 12 years was more important than an ongoing economic slump."	"BRA"	2
3427566	"en_CHN_mopost_int"	"2014-10-27 10:26:25"	"Out of juice? New battery technology could help smartphones last twice as long"	"Smartphones that last twice as long before they need to be recharged could become reality after a US tech start-up revealed a portable battery with double the capacity of those on the market."	"USA"	1
3428148	"en_CHN_mopost_int"	"2014-10-27 11:26:27"	"Ukraine leader to start coalition talks after winning pro-West mandate"	"Pro-Western parties will dominate Ukraine’s parliament after an election handed President Petro Poroshenko a mandate to end a separatist conflict and steer the country further out of Russia’s orbit into Europe’s mainstream."	"RUS"	1
3428148	"en_CHN_mopost_int"	"2014-10-27 11:26:27"	"Ukraine leader to start coalition talks after winning pro-West mandate"	"Pro-Western parties will dominate Ukraine’s parliament after an election handed President Petro Poroshenko a mandate to end a separatist conflict and steer the country further out of Russia’s orbit into Europe’s mainstream."	"UKR"	1
3430973	"en_CHN_mopost_int"	"2014-10-27 15:26:32"	"High-speed trains in France often travelling in the slow lane"	"Many of France's high-speed TGV trains, long hailed as the standard bearer of the nation's rail revolution, are travelling in the slow lane, an official report has revealed."	"FRA"	1
3430974	"en_CHN_mopost_int"	"2014-10-27 15:26:32"	"Global economic downturn is ‘driving men to have the snip’"	"It started with an offhand comment from a urologist's secretary: More men than usual were calling to schedule a vasectomy."	""	NA
3430975	"en_CHN_mopost_int"	"2014-10-27 15:26:32"	"Danish scientists find genetic link to children’s seizures after MMR vaccine"	"Scientists in Denmark say they have found genetic clues to explain why a small number of children have febrile seizures - brief convulsions - after receiving the measles, mumps and rubella (MMR) vaccine."	"DNK"	2
3430976	"en_CHN_mopost_int"	"2014-10-27 15:26:32"	"Canadian parliament shooter ‘made video’ before attack"	"The man who killed a Canadian soldier and attacked the country's parliament building last week made a video of himself beforehand, evidence he was driven by ideological and political motives, police said."	"CAN"	1
3430977	"en_CHN_mopost_int"	"2014-10-27 15:26:32"	"Darth Vadar’s presidential ambitions thwarted again in Ukraine"	"Darth Vader is in trouble in Ukraine - again. A candidate posing as the iconic villain from the Star Wars movies already had his Ukrainian presidential ambitions thwarted by suspicious authorities in May."	"UKR"	2
3430978	"en_CHN_mopost_int"	"2014-10-27 15:26:32"	"New York state backtracks on Ebola isolation policy"	"New York state has eased its rules for how those arriving from Ebola-stricken West Africa must be treated, ending a mandatory isolation period for people who had no contact with an infected patient."	"USA"	1
3430979	"en_CHN_mopost_int"	"2014-10-27 15:26:32"	"The windowless plane set for take-off in a decade"	"It is a glimpse into the future that will inspire wonder in some people but perhaps strike terror into the heart of the nervous flyer: a windowless plane that nonetheless allows passengers to see what's going on outside, as well as checking their email and surfing the internet."	""	NA
