"ID"	"feed"	"time"	"text1"	"text2"	"TAG"	"Nb_tag_detected"
3886085	"en_CHN_mopost_int"	"2014-12-05 16:07:33"	"British prosecutors to review 25 ‘Fake Sheik’ convictions"	"Twenty-five convictions secured through evidence given by British undercover reporter Mazher Mahmood - nicknamed the 'Fake Sheikh' - will be reviewed because of doubts over his reliability as a witness, prosecutors said on Thursday."	"GBR"	1
3886086	"en_CHN_mopost_int"	"2014-12-05 16:07:33"	"Chimpanzees are not the same as people, New York court rules"	"Chimpanzees are not entitled to the same rights as people, a New York state appeals court has ruled, thwarting an advocacy group's attempt to get primates freed from captivity."	"USA"	1
3886087	"en_CHN_mopost_int"	"2014-12-05 16:07:33"	"Migrants want to quit Greece but EU rules mean Athens must make them stay"	"Strapped to the underbelly of a train, 23-year-old Ali Arzin from Afghanistan had hoped to cross the border of crisis-hit Greece into Macedonia and eventually reach another EU country."	"AFG"	1
3886087	"en_CHN_mopost_int"	"2014-12-05 16:07:33"	"Migrants want to quit Greece but EU rules mean Athens must make them stay"	"Strapped to the underbelly of a train, 23-year-old Ali Arzin from Afghanistan had hoped to cross the border of crisis-hit Greece into Macedonia and eventually reach another EU country."	"GRC"	2
3886087	"en_CHN_mopost_int"	"2014-12-05 16:07:33"	"Migrants want to quit Greece but EU rules mean Athens must make them stay"	"Strapped to the underbelly of a train, 23-year-old Ali Arzin from Afghanistan had hoped to cross the border of crisis-hit Greece into Macedonia and eventually reach another EU country."	"MKD"	1
3886088	"en_CHN_mopost_int"	"2014-12-05 16:07:33"	"US spacecraft Orion developed for Mars trip lifts off on first test flight"	"Nasa’s next-generation spacecraft Orion, developed to carry astronauts to an asteroid in the 2020s and to Mars in the 2030s, was launched Friday from Cape Canaveral Air Force Station in Florida in its first unmanned test flight."	"USA"	2
3892745	"en_CHN_mopost_int"	"2014-12-06 07:47:23"	"Four passengers injured after assailant goes on stabbing spree aboard US train"	"A man wielding a knife went on a stabbing spree aboard a US passenger train on Friday, wounding four people including a train employee."	"USA"	1
3893736	"en_CHN_mopost_int"	"2014-12-06 10:47:27"	"US 'chokehold' protests enter third day as more police brutality cases fuel anger"	"Protesters in New York and other cities rallied for a third night on Friday denouncing the use of deadly force by police against minorities, even as prosecutors said they would consider charges against an officer in the fatal shooting of a unarmed black man in November."	"USA"	2
3897313	"en_CHN_mopost_int"	"2014-12-06 19:47:38"	"Experts urge people to think about the 'digital footprint' they'll leave behind"	"Many of us turn to the virtual world to mark major life events - graduating from school, scoring a promotion, getting married or having a baby."	"USA"	1
3897314	"en_CHN_mopost_int"	"2014-12-06 19:47:38"	"US journalist, S African hostage killed in Yemen during failed rescue attempt"	"American journalist Luke Somers and a South African hostage were killed during a failed attempt by US special forces to free them from al-Qaeda militants in Yemen."	"USA"	2
3897314	"en_CHN_mopost_int"	"2014-12-06 19:47:38"	"US journalist, S African hostage killed in Yemen during failed rescue attempt"	"American journalist Luke Somers and a South African hostage were killed during a failed attempt by US special forces to free them from al-Qaeda militants in Yemen."	"YEM"	1
3897314	"en_CHN_mopost_int"	"2014-12-06 19:47:38"	"US journalist, S African hostage killed in Yemen during failed rescue attempt"	"American journalist Luke Somers and a South African hostage were killed during a failed attempt by US special forces to free them from al-Qaeda militants in Yemen."	"ZAF"	1
3897316	"en_CHN_mopost_int"	"2014-12-06 19:47:38"	"What's in a name? Billions in tourist revenue it would seem, as Britain seeks Putonghua monikers for landmarks and celebrities"	"Learning Putonghua can leave even the most gifted linguist tongue-tied. So it's little wonder British tourism chiefs have called on native Chinese speakers to help out in naming some of the UK's iconic landmarks and celebrities."	"CHN"	1
3897316	"en_CHN_mopost_int"	"2014-12-06 19:47:38"	"What's in a name? Billions in tourist revenue it would seem, as Britain seeks Putonghua monikers for landmarks and celebrities"	"Learning Putonghua can leave even the most gifted linguist tongue-tied. So it's little wonder British tourism chiefs have called on native Chinese speakers to help out in naming some of the UK's iconic landmarks and celebrities."	"GBR"	3
3897319	"en_CHN_mopost_int"	"2014-12-06 19:47:38"	"Want to live forever? Tech firm wants to create your 'digital alter ego'"	"Ever dreamed of being immortal? A new tech start-up is hoping to turn that fantasy into reality by creating a 3D ""digital alter ego"" of yourself who will talk to your family and friends after you've died."	""	NA
3898654	"en_CHN_mopost_int"	"2014-12-06 23:47:42"	"British Museum ignites row by loaning Elgin Marbles piece to Russia"	"The British Museum has sparked a row across Europe after it allowed a piece of the disputed Elgin Marbles collection to go on show at Russia's Hermitage Museum with the Greek government condemning the loan."	"GBR"	1
3898654	"en_CHN_mopost_int"	"2014-12-06 23:47:42"	"British Museum ignites row by loaning Elgin Marbles piece to Russia"	"The British Museum has sparked a row across Europe after it allowed a piece of the disputed Elgin Marbles collection to go on show at Russia's Hermitage Museum with the Greek government condemning the loan."	"GRC"	1
3898654	"en_CHN_mopost_int"	"2014-12-06 23:47:42"	"British Museum ignites row by loaning Elgin Marbles piece to Russia"	"The British Museum has sparked a row across Europe after it allowed a piece of the disputed Elgin Marbles collection to go on show at Russia's Hermitage Museum with the Greek government condemning the loan."	"RUS"	1
3898655	"en_CHN_mopost_int"	"2014-12-06 23:47:42"	"Pentagon nominee Ashton Carter billed as wonkish technocrat"	"Even as a young man, Ashton Carter had eclectic interests, earning degrees in physics and medieval history at Yale and a doctorate in theoretical physics from Oxford University, where he was a Rhodes Scholar."	""	NA
3898656	"en_CHN_mopost_int"	"2014-12-06 23:47:42"	"Hackers use email to threaten Sony Pictures staff and their families"	"Sony Pictures staff received a threatening email claiming to be from the hackers who breached the entertainment giant's computer network, reportedly with warnings that they and their families were ""in danger""."	""	NA
3898657	"en_CHN_mopost_int"	"2014-12-06 23:47:42"	"Hollande meets Putin in Moscow in attempt to mend ties"	"French President Francois Hollande became the first European leader to fly to Russia in an attempt to defuse the stand-off with Vladimir Putin over Ukraine, where peace talks will take place next week."	"FRA"	2
3898657	"en_CHN_mopost_int"	"2014-12-06 23:47:42"	"Hollande meets Putin in Moscow in attempt to mend ties"	"French President Francois Hollande became the first European leader to fly to Russia in an attempt to defuse the stand-off with Vladimir Putin over Ukraine, where peace talks will take place next week."	"RUS"	3
3898657	"en_CHN_mopost_int"	"2014-12-06 23:47:42"	"Hollande meets Putin in Moscow in attempt to mend ties"	"French President Francois Hollande became the first European leader to fly to Russia in an attempt to defuse the stand-off with Vladimir Putin over Ukraine, where peace talks will take place next week."	"UKR"	1
3898658	"en_CHN_mopost_int"	"2014-12-06 23:47:42"	"Mexican authorities close in on Knights Templar drug cartel"	"Mexican authorities arrested the uncle of one of the country's most notorious and most wanted drug lords, the head of the Knights Templar cartel, officials said on Friday."	"MEX"	1
3898659	"en_CHN_mopost_int"	"2014-12-06 23:47:42"	"Muslim Brotherhood faked tapes of Mursi arrest collusion: prosecutor"	"Egypt's government has denied it fabricated key documents linked to the trial of Mohammed Mursi."	"EGY"	1
3898660	"en_CHN_mopost_int"	"2014-12-06 23:47:42"	"Rocking Rio de Janeiro opens its first nude beach"	"Pedro Ribeiro lives just one block away from Copacabana beach. But almost every weekend he drives nearly three hours to soak up the sun on his own terms in the buff."	"BRA"	2
3898661	"en_CHN_mopost_int"	"2014-12-06 23:47:42"	"Zoella, the British vlogger, is the new queen of the internet"	"The internet has brought a great many things into this world, from social networking, email and memes to online dating and even arguably revolution."	"GBR"	1
3898662	"en_CHN_mopost_int"	"2014-12-06 23:47:42"	"Britain expands Gulf footprint with Bahrain naval base deal"	"Britain's top diplomat says his nation has signed a deal with Bahrain to bolster the British military presence in the Gulf."	"BHR"	1
3898662	"en_CHN_mopost_int"	"2014-12-06 23:47:42"	"Britain expands Gulf footprint with Bahrain naval base deal"	"Britain's top diplomat says his nation has signed a deal with Bahrain to bolster the British military presence in the Gulf."	"GBR"	2
3898663	"en_CHN_mopost_int"	"2014-12-06 23:47:42"	"Grace Mugabe confirmed as head of Zanu-PF women's wing, underlining swift political rise"	"Zimbabwe's ruling Zanu-PF party confirmed President Robert Mugabe's wife Grace as the new head of its women's wing at a congress, underlining her swift political rise in the troubled African country."	"ZWE"	1
3898664	"en_CHN_mopost_int"	"2014-12-06 23:47:42"	"France to pay compensation for rail firm's transports to Nazi death camps"	"Thousands of Holocaust survivors and family members in the United States and elsewhere will be entitled to compensation from a US$60 million French-US fund."	"FRA"	2
3898664	"en_CHN_mopost_int"	"2014-12-06 23:47:42"	"France to pay compensation for rail firm's transports to Nazi death camps"	"Thousands of Holocaust survivors and family members in the United States and elsewhere will be entitled to compensation from a US$60 million French-US fund."	"USA"	2
3898665	"en_CHN_mopost_int"	"2014-12-06 23:47:42"	"British 'gigolo' Ian Griffin jailed for 20 years for girlfriend's murder in Paris"	"A British businessman described as a ""gigolo"" was jailed for 20 years for murdering his girlfriend in a five-star Paris hotel."	"FRA"	1
3898665	"en_CHN_mopost_int"	"2014-12-06 23:47:42"	"British 'gigolo' Ian Griffin jailed for 20 years for girlfriend's murder in Paris"	"A British businessman described as a ""gigolo"" was jailed for 20 years for murdering his girlfriend in a five-star Paris hotel."	"GBR"	1
3898666	"en_CHN_mopost_int"	"2014-12-06 23:47:42"	"Tributes paid after Belgium's former queen Fabiola dies aged 86"	"Belgium's former queen Fabiola, the Spanish-born widow of the popular king Baudouin, who was recently at the centre of a row over her yearly allowance, died on Friday aged 86."	"BEL"	1
3898666	"en_CHN_mopost_int"	"2014-12-06 23:47:42"	"Tributes paid after Belgium's former queen Fabiola dies aged 86"	"Belgium's former queen Fabiola, the Spanish-born widow of the popular king Baudouin, who was recently at the centre of a row over her yearly allowance, died on Friday aged 86."	"ESP"	1
3898667	"en_CHN_mopost_int"	"2014-12-06 23:47:42"	"First daughters and sons: The perils of growing up in the White House"	"The children of presidents have long captured the imagination of Americans - and criticism."	"USA"	1
3901979	"en_CHN_mopost_int"	"2014-12-07 11:09:13"	"Fears for 43 missing Mexican students after body identified"	"Fears that 43 Mexican students missing since September were slaughtered by a police-backed gang have risen after one of the young men was identified among charred remains found in a landfill."	"MEX"	1
3903193	"en_CHN_mopost_int"	"2014-12-07 14:09:16"	"Widow of beheaded British IS hostage David Haines brands killers ‘monsters’"	"The widow of British aid worker David Haines, who was taken hostage and beheaded by Islamic State militants, branded his killers inhuman monsters in her first television interview broadcast Sunday."	"GBR"	1
3906401	"en_CHN_mopost_int"	"2014-12-07 22:09:26"	"Deaths of Somers and Korkie in Yemen underscore dangers of missions to rescue hostages"	"The death of American photojournalist Luke Somers in a special forces rescue operation in Yemen was a reminder that such high-risk missions are as likely to fail as to succeed."	"USA"	1
3906401	"en_CHN_mopost_int"	"2014-12-07 22:09:26"	"Deaths of Somers and Korkie in Yemen underscore dangers of missions to rescue hostages"	"The death of American photojournalist Luke Somers in a special forces rescue operation in Yemen was a reminder that such high-risk missions are as likely to fail as to succeed."	"YEM"	1
3906402	"en_CHN_mopost_int"	"2014-12-07 22:09:26"	"Washington Post reporter Rezaian faces unclear charges in Iran"	"Jason Rezaian, a Washington Post reporter detained in Iran for more than four months, was officially charged in a day-long proceeding in a Tehran courtroom, according to a source familiar with the case."	"IRN"	2
3906402	"en_CHN_mopost_int"	"2014-12-07 22:09:26"	"Washington Post reporter Rezaian faces unclear charges in Iran"	"Jason Rezaian, a Washington Post reporter detained in Iran for more than four months, was officially charged in a day-long proceeding in a Tehran courtroom, according to a source familiar with the case."	"USA"	1
3906403	"en_CHN_mopost_int"	"2014-12-07 22:09:26"	"Mothers insist they know breast in Claridge's protest"	"A group of mothers staged a group breastfeed outside one of London's top hotels after a woman nursing her baby there was told to cover up."	"GBR"	1
3906404	"en_CHN_mopost_int"	"2014-12-07 22:09:26"	"US probe's 9-year journey to explore Pluto from 260 million kilometres away"	"An American probe that will explore Pluto woke up from its slumber after a nine-year journey to take a close look at the distant body for the first time."	"USA"	2
3906405	"en_CHN_mopost_int"	"2014-12-07 22:09:26"	"1963 Batmobile fetches US$137,000 at auction"	"The original Batmobile fetched US$137,000 at auction, a small fraction of the US$4.2 million that a buyer paid last year for another version built for the television show that aired during the 1960s."	"USA"	1
3906406	"en_CHN_mopost_int"	"2014-12-07 22:09:26"	"Protesters clash with police in Greece over shooting of unarmed teenager"	"A march by thousands of people through central Athens to mark the anniversary of the fatal police shooting of an unarmed teenager quickly turned violent."	"GRC"	2
3906407	"en_CHN_mopost_int"	"2014-12-07 22:09:26"	"Six Guantanamo detainees in Cuba transferred to Uruguay"	"Six Guantanamo detainees have been transferred to Uruguay from the American military base in Cuba, where 136 detainees remain, the Pentagon said."	"CUB"	1
3906407	"en_CHN_mopost_int"	"2014-12-07 22:09:26"	"Six Guantanamo detainees in Cuba transferred to Uruguay"	"Six Guantanamo detainees have been transferred to Uruguay from the American military base in Cuba, where 136 detainees remain, the Pentagon said."	"URY"	1
3906407	"en_CHN_mopost_int"	"2014-12-07 22:09:26"	"Six Guantanamo detainees in Cuba transferred to Uruguay"	"Six Guantanamo detainees have been transferred to Uruguay from the American military base in Cuba, where 136 detainees remain, the Pentagon said."	"USA"	1
3906408	"en_CHN_mopost_int"	"2014-12-07 22:09:26"	"New York quiet after latest police shooting victim's funeral"	"Mourners in New York held a funeral on a rain-soaked Saturday for a black man shot dead by a white patrol officer, as a sympathy protest in California turned violent."	"USA"	2
3906409	"en_CHN_mopost_int"	"2014-12-07 22:09:26"	"Police in the US rarely face criminal charges in fatal shootings"	"At least 400 people are killed by police officers in the United States every year, and while the circumstances are different, one thing remains constant: In only a handful of instances do grand juries issue an indictment."	"USA"	2
3906410	"en_CHN_mopost_int"	"2014-12-07 22:09:26"	"Photojournalist Somers was driven to document lives of the ordinary"	"American photojournalist Luke Somers, who was killed in Yemen during a failed raid to free him from his al-Qaeda kidnappers, was driven by an urge to document the lives of ordinary people."	"USA"	1
3906410	"en_CHN_mopost_int"	"2014-12-07 22:09:26"	"Photojournalist Somers was driven to document lives of the ordinary"	"American photojournalist Luke Somers, who was killed in Yemen during a failed raid to free him from his al-Qaeda kidnappers, was driven by an urge to document the lives of ordinary people."	"YEM"	1
3906411	"en_CHN_mopost_int"	"2014-12-07 22:09:26"	"Scotland's Salmond to run for British parliament"	"Alex Salmond, who quit as Scotland's first minister after losing the independence referendum, will run for a seat in the British parliament in the May general election."	"GBR"	2
3906412	"en_CHN_mopost_int"	"2014-12-07 22:09:26"	"Paris Mayor Hidalgo wants diesel cars to be banned in city by 2020"	"The mayor of Paris called for diesel cars to be banned from the French capital by 2020 and said pedestrian-only neighbourhoods should be created in the city centre as part of a plan to fight pollution."	"FRA"	2
3906413	"en_CHN_mopost_int"	"2014-12-07 22:09:26"	"Mugabe's wife might have eyes on being his successor as Zimbabwe's president"	"The wife of Zimbabwe's veteran leader Robert Mugabe has been called ""Gucci Grace"" and ""First Shopper"". But some suspect she may be looking for a new title - ""Mrs President""."	"ZWE"	1
3906414	"en_CHN_mopost_int"	"2014-12-07 22:09:26"	"Rolling Stone apology does not change reality that sexual assault is a problem on US college campuses, victim advocates say"	"Advocates for sexual-assault victims say Rolling Stone's backpedalling from an explosive account of a gang rape at the University of Virginia doesn't change the fact that rape is a problem on college campuses and must be confronted."	"USA"	1
3908032	"en_CHN_mopost_int"	"2014-12-08 02:48:41"	"Police fire tear gas as 'US chokehold cop' protest in California turns violent"	"Three officers and a technician were hurt and six people arrested in California when a protest over police killings turned violent overnight."	"USA"	2
3908383	"en_CHN_mopost_int"	"2014-12-08 03:48:42"	"Drone in near-miss with passenger jet at London Heathrow, report claims"	"A passenger jet was involved in a near-miss with a drone at London Heathrow, one of the world’s busiest airports, a report cited by the Sunday Times newspaper said."	"GBR"	1
3908510	"en_CHN_mopost_int"	"2014-12-08 04:09:34"	"Why naturalist Paul Rosolie let an anaconda swallow him"	"When naturalist Paul Rosolie wanted to focus attention on the destruction of the Amazon rainforest, he decided he needed a stunt guaranteed to get people looking."	""	NA
3908646	"en_CHN_mopost_int"	"2014-12-08 04:48:43"	"Syria blames Israel for air strikes on Damascus airport"	"Syria accused Israel of bombing its main international airport on Sunday as the UN announced talks with rebel leaders on a ceasefire in its war-battered second city of Aleppo."	"ISR"	1
3908646	"en_CHN_mopost_int"	"2014-12-08 04:48:43"	"Syria blames Israel for air strikes on Damascus airport"	"Syria accused Israel of bombing its main international airport on Sunday as the UN announced talks with rebel leaders on a ceasefire in its war-battered second city of Aleppo."	"SYR"	3
3909206	"en_CHN_mopost_int"	"2014-12-08 06:09:41"	"Eleven died alongside two hostages in botched Yemen rescue"	"A woman, a 10-year-old boy and a local al-Qaeda leader were among at least 11 people killed alongside two Western hostages when US-led forces fought Islamist militants in a failed rescue mission in Yemen, residents said on Sunday."	"USA"	1
3909206	"en_CHN_mopost_int"	"2014-12-08 06:09:41"	"Eleven died alongside two hostages in botched Yemen rescue"	"A woman, a 10-year-old boy and a local al-Qaeda leader were among at least 11 people killed alongside two Western hostages when US-led forces fought Islamist militants in a failed rescue mission in Yemen, residents said on Sunday."	"YEM"	1
3909395	"en_CHN_mopost_int"	"2014-12-08 06:48:47"	"Prince William, Duchess Kate to test their political skills on action-packed US visit"	"Prince William and his pregnant wife, the Duchess of Cambridge, are flying to New York this week for a glitzy visit that marks a step-up in their role representing Britain abroad, royal commentators said."	"GBR"	1
3909395	"en_CHN_mopost_int"	"2014-12-08 06:48:47"	"Prince William, Duchess Kate to test their political skills on action-packed US visit"	"Prince William and his pregnant wife, the Duchess of Cambridge, are flying to New York this week for a glitzy visit that marks a step-up in their role representing Britain abroad, royal commentators said."	"USA"	2
3909805	"en_CHN_mopost_int"	"2014-12-08 07:48:50"	"Eaten alive? Underwhelming anaconda stunt leaves viewers with a bitter taste"	"When naturalist Paul Rosolie wanted to focus attention on the destruction of the Amazon rainforest, he decided he needed something  guaranteed to get people looking."	""	NA
3909958	"en_CHN_mopost_int"	"2014-12-08 08:09:45"	"Are hunger strikes effective? What Occupy students could learn from historical protests"	"On Saturday, Hong Kong student activist Joshua Wong Chi-fung, of the group Scholarism, ended a hunger strike he had initiated"	"HKG"	1
3913793	"en_CHN_mopost_int"	"2014-12-08 14:48:58"	"South African court clears Briton Shrien Dewani of honeymoon murder"	"A South African court cleared British businessman Shrien Dewani on Monday of charges that he paid hitmen to kill his wife while they were on honeymoon in Cape Town four years ago."	"GBR"	2
3913793	"en_CHN_mopost_int"	"2014-12-08 14:48:58"	"South African court clears Briton Shrien Dewani of honeymoon murder"	"A South African court cleared British businessman Shrien Dewani on Monday of charges that he paid hitmen to kill his wife while they were on honeymoon in Cape Town four years ago."	"ZAF"	1
3914044	"en_CHN_mopost_int"	"2014-12-08 15:09:55"	"Australian PM Abbott admits going through a ‘rough patch’"	"Australian Prime Minister Tony Abbott admitted yesterday he was going through ""a rough patch"" as voters desert him over tough spending cuts and perceived broken promises."	"AUS"	2
3914045	"en_CHN_mopost_int"	"2014-12-08 15:09:55"	"19 treated at hospital after chlorine gas forces evacuation of suburban Chicago hotel"	"Chlorine gas made several people sick and forced the evacuation of thousands of guests from a suburban Chicago hotel, including many who were dressed in cartoonish animal costumes for an annual furries convention who were ushered across the street to a convention centre h"	"USA"	1
3914046	"en_CHN_mopost_int"	"2014-12-08 15:09:55"	"200 passengers on a cruise ship in New Zealand sickened by norovirus"	"Health authorities in New Zealand said yesterday that about 200 passengers on a cruise ship have been sickened by an outbreak of norovirus."	"NZL"	1
3914047	"en_CHN_mopost_int"	"2014-12-08 15:09:55"	"South Africa mourns teacher Pierre Korkie, who was killed in Yemen"	"South Africa was mourning a teacher who had left a comfortable life back home to help children in Yemen, but was taken hostage and killed in a botched attempt to rescue a US hostage."	"USA"	1
3914047	"en_CHN_mopost_int"	"2014-12-08 15:09:55"	"South Africa mourns teacher Pierre Korkie, who was killed in Yemen"	"South Africa was mourning a teacher who had left a comfortable life back home to help children in Yemen, but was taken hostage and killed in a botched attempt to rescue a US hostage."	"YEM"	1
3914047	"en_CHN_mopost_int"	"2014-12-08 15:09:55"	"South Africa mourns teacher Pierre Korkie, who was killed in Yemen"	"South Africa was mourning a teacher who had left a comfortable life back home to help children in Yemen, but was taken hostage and killed in a botched attempt to rescue a US hostage."	"ZAF"	1
3914048	"en_CHN_mopost_int"	"2014-12-08 15:09:55"	"Veterans mark Pearl Harbour battle"	"For the fifth year in a row, Lou Conter made the trip to Honolulu from his Alta Sierra, California, home to remember his USS Arizona shipmates who died in the surprise air attack on Pearl Harbour on December 7, 1941."	"USA"	1
3914049	"en_CHN_mopost_int"	"2014-12-08 15:09:55"	"Biggest emitters should do the most to battle climate change, Australian Foreign Minister Bishop says"	"Nations with the biggest greenhouse gas emissions should be doing the most to fight climate change or the efforts of other countries will be cancelled out, Australia's Foreign Minister Julie Bishop said yesterday."	"AUS"	2
3914050	"en_CHN_mopost_int"	"2014-12-08 15:09:55"	"Nearly half the climate change financing went to 10 countries, UK think tank says"	"Half of nearly US$8 billion in climate finance given to the developing world since 2003 went to just 10 countries, and nations most at risk got the short end of the stick, a report said."	"GBR"	1
3914050	"en_CHN_mopost_int"	"2014-12-08 15:09:55"	"Nearly half the climate change financing went to 10 countries, UK think tank says"	"Half of nearly US$8 billion in climate finance given to the developing world since 2003 went to just 10 countries, and nations most at risk got the short end of the stick, a report said."	"USA"	1
3914051	"en_CHN_mopost_int"	"2014-12-08 15:09:55"	"Protesters clash with police in Berkeley, California, over verdict in New York chokehold case"	"Protesters in northern California hurled objects at police, who responded by firing gas for a second consecutive night, as demonstrations continued over the death of a black man after he was put in a chokehold by a police officer in New York."	"USA"	2
