"ID"	"feed"	"time"	"text1"	"text2"	"TAG"	"Nb_tag_detected"
3119807	"en_CHN_mopost_int"	"2014-10-01 07:19:19"	"White House calls for ‘genuine choice’ in Hong Kong elections after petition attracts 200,000 signatures"	"The White House has responded to a petition on its website which attracted around 200,000 signatures, calling upon it to “press the Chinese government to"	"CHN"	1
3119807	"en_CHN_mopost_int"	"2014-10-01 07:19:19"	"White House calls for ‘genuine choice’ in Hong Kong elections after petition attracts 200,000 signatures"	"The White House has responded to a petition on its website which attracted around 200,000 signatures, calling upon it to “press the Chinese government to"	"HKG"	1
3119807	"en_CHN_mopost_int"	"2014-10-01 07:19:19"	"White House calls for ‘genuine choice’ in Hong Kong elections after petition attracts 200,000 signatures"	"The White House has responded to a petition on its website which attracted around 200,000 signatures, calling upon it to “press the Chinese government to"	"USA"	1
3121766	"en_CHN_mopost_int"	"2014-10-01 11:19:24"	"Ebola spreads to US as airline passenger who flew from Liberia confirmed to have deadly virus"	"A man who flew from Liberia to Texas has become the first patient infected with the deadly Ebola virus to be diagnosed in the United States, health officials said."	"LBR"	1
3121766	"en_CHN_mopost_int"	"2014-10-01 11:19:24"	"Ebola spreads to US as airline passenger who flew from Liberia confirmed to have deadly virus"	"A man who flew from Liberia to Texas has become the first patient infected with the deadly Ebola virus to be diagnosed in the United States, health officials said."	"USA"	3
3122300	"en_CHN_mopost_int"	"2014-10-01 12:19:25"	"US congressman to set up Hong Kong Caucus to monitor city’s human rights"	"US congressman Chris Smith, chairman of the House of Representatives’ subcommittee on global human rights, has vowed to establish a Hong Kong Caucus to monitor human rights in the city."	"HKG"	1
3122300	"en_CHN_mopost_int"	"2014-10-01 12:19:25"	"US congressman to set up Hong Kong Caucus to monitor city’s human rights"	"US congressman Chris Smith, chairman of the House of Representatives’ subcommittee on global human rights, has vowed to establish a Hong Kong Caucus to monitor human rights in the city."	"USA"	1
3124281	"en_CHN_mopost_int"	"2014-10-01 15:19:29"	"Could 'sensible' home secretary Theresa May succeed Cameron?"	"To people outside Britain, a government minister talking about ending the persecution of young black men by the police might seem unremarkable. When Home Secretary Theresa May did so in her speech to the ruling Conservative party's annual convention on Tuesday it was the latest landmark in a 12-year battle to modernise her party that reinforced her claim to succeed Prime Minister David Cameron as its leader."	"GBR"	2
3124283	"en_CHN_mopost_int"	"2014-10-01 15:19:29"	"Battle resumes in the United States over law enforcement access to mobile devices"	"A new battle is brewing in the United States over privacy for mobile devices, after moves by Google and Apple to toughen the encryption of their mobile devices sparked complaints from law enforcers."	"USA"	1
3124969	"en_CHN_mopost_int"	"2014-10-01 16:19:32"	"Lufthansa loses court case over male pilots' headwear"	"German flag carrier Lufthansa, which faced a pilots' strike on Tuesday, suffered a fresh setback when it lost a labour dispute over whether pilots should have to wear their caps."	"DEU"	1
3124969	"en_CHN_mopost_int"	"2014-10-01 16:19:32"	"Lufthansa loses court case over male pilots' headwear"	"German flag carrier Lufthansa, which faced a pilots' strike on Tuesday, suffered a fresh setback when it lost a labour dispute over whether pilots should have to wear their caps."	"MDV"	1
3124970	"en_CHN_mopost_int"	"2014-10-01 16:19:32"	"Global hacking ring allegedly targeted US Army and computer game makers"	"Four members of an international hacking ring were charged with cracking the networks of the US Army and developers of blockbuster video wargames to steal software, prosecutors said."	"USA"	1
3124971	"en_CHN_mopost_int"	"2014-10-01 16:19:32"	"Microsoft skips 9 to introduce Windows 10"	"The next version of Microsoft's flagship operating system will be called Windows 10, as the company skips version 9 to emphasise advances it is making towards a world centred on mobile devices and internet services."	""	NA
3126336	"en_CHN_mopost_int"	"2014-10-01 18:19:35"	"US cinema chains refuse to premiere 'Crouching Tiger' sequel"	"US cinema chain Regal Entertainment said it would not premiere the sequel to Crouching Tiger, Hidden Dragon on any of its IMAX screens, objecting to a move by IMAX and Netflix to sidestep a normal theatrical release."	"USA"	1
3126337	"en_CHN_mopost_int"	"2014-10-01 18:19:35"	"Murdoch's News Corp snaps up US online real-estate group Move"	"Rupert Murdoch's News Corp has agreed to buy Move, a US property website business, for US$950 million in a bet on the recovery in the world's biggest housing market."	"USA"	1
3126338	"en_CHN_mopost_int"	"2014-10-01 18:19:35"	"On top of the world - Monaco's world record HK$3.3b penthouse"	"From atop the Odeon Tower penthouse, residents will be able to launch themselves down a slide, plunging two storeys into the open-air infinity pool below."	"MCO"	2
3126339	"en_CHN_mopost_int"	"2014-10-01 18:19:35"	"Armed man with criminal record was allowed into lift with Barack Obama"	"A gun-carrying security contractor with three prior convictions for assault and battery was allowed into a lift with US President Barack Obama during a September 16 trip to Atlanta, violating Secret Service protocols, according to three people familiar with the incident."	"USA"	2
3129362	"en_CHN_mopost_int"	"2014-10-01 23:19:41"	"British PM David Cameron pledges tax cuts for 30 million"	"Britain's Prime Minister David Cameron was cheered yesterday as he pledged sweeping tax cuts for almost half the population in a pitch designed to woo voters and guarantee re-election next year."	"GBR"	3
3131595	"en_CHN_mopost_int"	"2014-10-02 04:19:48"	"US Secret Service chief quits over security breaches"	"The director of the United States Secret Service has resigned following a number of security breaches including a recent incident where an armed man entered the White House"	"USA"	3
3131966	"en_CHN_mopost_int"	"2014-10-02 05:19:49"	"German Chancellor urges Russian president to use influence over Ukraine rebels"	"German Chancellor Angela Merkel, during a telephone call with President Vladimir Putin on Wednesday, stressed Moscow’s “responsibility” to act as a moderating influence over the pro-Russian separatists in eastern Ukraine."	"DEU"	2
3131966	"en_CHN_mopost_int"	"2014-10-02 05:19:49"	"German Chancellor urges Russian president to use influence over Ukraine rebels"	"German Chancellor Angela Merkel, during a telephone call with President Vladimir Putin on Wednesday, stressed Moscow’s “responsibility” to act as a moderating influence over the pro-Russian separatists in eastern Ukraine."	"RUS"	3
3131966	"en_CHN_mopost_int"	"2014-10-02 05:19:49"	"German Chancellor urges Russian president to use influence over Ukraine rebels"	"German Chancellor Angela Merkel, during a telephone call with President Vladimir Putin on Wednesday, stressed Moscow’s “responsibility” to act as a moderating influence over the pro-Russian separatists in eastern Ukraine."	"UKR"	1
3132334	"en_CHN_mopost_int"	"2014-10-02 06:19:50"	"Dozens of US universities stage rallies in support of Hong Kong's protesting students"	"Events were held on dozens of university and college campuses across North America on October 1st in support of pro-democracy protesters in Hong Kong."	"HKG"	1
3132334	"en_CHN_mopost_int"	"2014-10-02 06:19:50"	"Dozens of US universities stage rallies in support of Hong Kong's protesting students"	"Events were held on dozens of university and college campuses across North America on October 1st in support of pro-democracy protesters in Hong Kong."	"USA"	1
3132764	"en_CHN_mopost_int"	"2014-10-02 07:19:52"	"‘We belong to Hong Kong’: Thousands gather at solidarity events in 64 cities worldwide"	"Thousands of people from around the world have voiced support for ongoing pro-democracy protests in Hong Kong at solidarity events in"	"HKG"	1
3132765	"en_CHN_mopost_int"	"2014-10-02 07:19:52"	"Iraqi Kurds fight Islamic State with antiquated weapons"	"The exhausted Kurdish fighters leaned against a pair of antiquated green cannons on a hill overlooking this northern Iraqi village, the ground around them littered with shrapnel from fierce battles with Islamic State militants."	"IRQ"	1
3133261	"en_CHN_mopost_int"	"2014-10-02 08:19:53"	"US sharply criticises new Israeli housing project"	"The Obama administration warned Israel on Wednesday that its plans for a controversial new housing project in east Jerusalem would distance Israel from “even its closest allies” and raise questions about its commitment to seeking peace with Palestinians."	"ISR"	3
3133261	"en_CHN_mopost_int"	"2014-10-02 08:19:53"	"US sharply criticises new Israeli housing project"	"The Obama administration warned Israel on Wednesday that its plans for a controversial new housing project in east Jerusalem would distance Israel from “even its closest allies” and raise questions about its commitment to seeking peace with Palestinians."	"PSE"	1
3133261	"en_CHN_mopost_int"	"2014-10-02 08:19:53"	"US sharply criticises new Israeli housing project"	"The Obama administration warned Israel on Wednesday that its plans for a controversial new housing project in east Jerusalem would distance Israel from “even its closest allies” and raise questions about its commitment to seeking peace with Palestinians."	"USA"	2
3135273	"en_CHN_mopost_int"	"2014-10-02 12:19:58"	"Peace laureate says South Africa Nobel summit axed after Dalai Lama visa row involving China"	"A global summit of Nobel laureates has been cancelled after the event was hit by a boycott over the South African government’s refusal to grant the Dalai Lama a visa, peace prize winner Jody Williams said Wednesday."	"CHN"	2
3135273	"en_CHN_mopost_int"	"2014-10-02 12:19:58"	"Peace laureate says South Africa Nobel summit axed after Dalai Lama visa row involving China"	"A global summit of Nobel laureates has been cancelled after the event was hit by a boycott over the South African government’s refusal to grant the Dalai Lama a visa, peace prize winner Jody Williams said Wednesday."	"ZAF"	2
3138130	"en_CHN_mopost_int"	"2014-10-02 16:20:04"	"Wreck from Franklin Northwest Passage expedition is HMS Erebus"	"Experts have identified a shipwreck uncovered last month in the Arctic as the HMS Erebus, the ship British Rear Admiral Sir John Franklin was probably sailing on when it vanished with another vessel 170 years ago, Canada's prime minister announced."	"CAN"	1
3138130	"en_CHN_mopost_int"	"2014-10-02 16:20:04"	"Wreck from Franklin Northwest Passage expedition is HMS Erebus"	"Experts have identified a shipwreck uncovered last month in the Arctic as the HMS Erebus, the ship British Rear Admiral Sir John Franklin was probably sailing on when it vanished with another vessel 170 years ago, Canada's prime minister announced."	"GBR"	1
3138131	"en_CHN_mopost_int"	"2014-10-02 16:20:04"	"'Man in the Moon' caused by volcanic action, US scientists theorise"	"The giant basin on the near side of the moon might not be the result of a collision with a massive asteroid, contrary to what some scientists believed."	"USA"	1
3138132	"en_CHN_mopost_int"	"2014-10-02 16:20:04"	"Facebook grants drag queens exception from 'real name' account policy"	"Facebook has vowed to ease its ""real names"" policy, which prompted drag queen performers to quit the social network and sparked wider protests in the gay community and beyond."	""	NA
3138133	"en_CHN_mopost_int"	"2014-10-02 16:20:04"	"Epson starts home printing revolution with tank to replace inkjet cartridges"	"The millions of inkjet cartridges that households go through every year could become a thing of the past after Epson unveiled new ink tanks it claims will revolutionise the economics of home printing."	""	NA
3138134	"en_CHN_mopost_int"	"2014-10-02 16:20:04"	"Notorious Mexico drugs lord Hector Beltran Leyva captured by soldiers"	"Hector Beltran Leyva, a notorious drug lord, has been captured by soldiers at a seafood restaurant in a picturesque town in central Mexico."	"MEX"	2
3138263	"en_CHN_mopost_int"	"2014-10-02 16:23:22"	"Exposed: the web of fake IDs behind Canada's anti-immigration groups"	"An investigation by the South China Morning Post has uncovered a web of fake identities, bogus social media accounts and misleading email addresses pushing the agenda of two Canadian anti-immigration groups."	"CAN"	2
3138263	"en_CHN_mopost_int"	"2014-10-02 16:23:22"	"Exposed: the web of fake IDs behind Canada's anti-immigration groups"	"An investigation by the South China Morning Post has uncovered a web of fake identities, bogus social media accounts and misleading email addresses pushing the agenda of two Canadian anti-immigration groups."	"CHN"	1
3138936	"en_CHN_mopost_int"	"2014-10-02 17:20:06"	"US Ebola patient took three flights on two airlines over 28 hours"	"The first reported case of Ebola in the United States is spooking airline investors and raising the prospect that some frightened travellers might stay home despite repeated reassurances from public-health experts."	"USA"	2
3138937	"en_CHN_mopost_int"	"2014-10-02 17:20:06"	"Immigration Watch decries Canadian diversity as 'colonisation'"	"Advocacy group Immigration Watch Canada wants a dramatic reduction in immigration to Canada, and recognition of ""cultural limits"" to immigration. It derides those who ""celebrate diversity"". Doing so condemns ""long-term residents"" and ""mainstream"" Canadians to ""marginalisation and colonisation"", it says."	"CAN"	3
3139623	"en_CHN_mopost_int"	"2014-10-02 18:20:10"	"Genes of mother's ex-partner show up in young flies. As for humans …"	"What if your genetic destiny wasn't written solely by your two biological parents, but also by your mother's first sexual partner? That is the case for neriid flies, which seem to develop differently based on the traits of their mothers' previous partners."	""	NA
3140385	"en_CHN_mopost_int"	"2014-10-02 19:20:11"	"Notorious Mexico drug lord Hector Beltran Leyva captured by soldiers"	"Notorious drug lord Hector Beltran Leyva has been caught by soldiers at a seafood restaurant in a picturesque Mexican town."	"MEX"	3
3142783	"en_CHN_mopost_int"	"2014-10-02 23:20:16"	"A D.I.Y. semi-automatic rifle, brought to you man behind 3D-printed handgun"	"The creator of the world's first 3D plastic handgun has unveiled his latest invention: a pre-programmed metal-milling machine that enables anyone to easily make the core component of a semi-automatic rifle."	""	NA
3142784	"en_CHN_mopost_int"	"2014-10-02 23:20:16"	"Red faces after Banksy mural destroyed over 'racist' claim"	"Authorities in southern England were embarrassed but defensive yesterday after telling workers to destroy a mural they later realised was created by the internationally famous graffiti artist Banksy."	"GBR"	1
3142785	"en_CHN_mopost_int"	"2014-10-02 23:20:16"	"First commercial carbon-capture project, in Canada, will be closely watched"	"Canada will today launch the world's first commercial-scale carbon capture and storage project at a coal-fired power plant, a closely watched experiment designed to cut 90 per cent of the plant's carbon emissions."	"CAN"	1
3142871	"en_CHN_mopost_int"	"2014-10-02 23:23:44"	"South African Nobel Peace Prize summit scrapped over Dalai Lama visa snub"	"Cape Town's mayor yesterday ""suspended"" a planned summit of Nobel peace laureates, blaming the South African government's ""intransigence"" in refusing to grant a visa to the Dalai Lama."	"CHN"	1
3142871	"en_CHN_mopost_int"	"2014-10-02 23:23:44"	"South African Nobel Peace Prize summit scrapped over Dalai Lama visa snub"	"Cape Town's mayor yesterday ""suspended"" a planned summit of Nobel peace laureates, blaming the South African government's ""intransigence"" in refusing to grant a visa to the Dalai Lama."	"ZAF"	1
3145424	"en_CHN_mopost_int"	"2014-10-03 05:20:37"	"Turkey steels for action as Islamic State advances on Syrian border town"	"Turkey’s parliament authorised the government on Thursday to order military action against Islamic State as the jihadists tightened their grip on a Syrian border town, sending thousands more Kurdish refugees into Turkey."	"SYR"	1
3145424	"en_CHN_mopost_int"	"2014-10-03 05:20:37"	"Turkey steels for action as Islamic State advances on Syrian border town"	"Turkey’s parliament authorised the government on Thursday to order military action against Islamic State as the jihadists tightened their grip on a Syrian border town, sending thousands more Kurdish refugees into Turkey."	"TUR"	1
3146789	"en_CHN_mopost_int"	"2014-10-03 08:24:17"	"Canada dismemberment trial shown video of fatal meeting between Lin and Magnotta"	"Images of a Canadian man holding a door for the Chinese student he later dismembered were shown at trial on Thursday, with the prosecution telling the jury the footage was from surveillance cameras at the building where the gruesome murder took place."	"CAN"	2
3146789	"en_CHN_mopost_int"	"2014-10-03 08:24:17"	"Canada dismemberment trial shown video of fatal meeting between Lin and Magnotta"	"Images of a Canadian man holding a door for the Chinese student he later dismembered were shown at trial on Thursday, with the prosecution telling the jury the footage was from surveillance cameras at the building where the gruesome murder took place."	"CHN"	1
3150616	"en_CHN_mopost_int"	"2014-10-03 15:20:58"	"Hackers who attacked JPMorgan accessed data of 76 million households"	"Hackers exploited an employee password to crack a JPMorgan Chase server and pull off one of the largest cyber-attacks ever, accessing data on 76 million households and 7 million businesses."	""	NA
3151221	"en_CHN_mopost_int"	"2014-10-03 16:21:01"	"Sperm bank in US sued after woman given donor sperm from wrong man"	"A woman in America is suing a sperm bank after she became pregnant with sperm donated by a black man instead of a white man as she had intended."	"USA"	1
3151222	"en_CHN_mopost_int"	"2014-10-03 16:21:01"	"Massive undersea scars and mountains revealed by satellite mapping"	"Scientists have devised a map of the earth's sea floor using satellite data, revealing massive underwater scars and thousands of previously uncharted mountains in some of the deepest, most remote ocean areas."	""	NA
3151224	"en_CHN_mopost_int"	"2014-10-03 16:21:01"	"Facebook poised to enter health-care sector with 'support communities'"	"Facebook already knows who your friends are and the kind of things that grab your attention. Soon, it could also know the state of your health."	""	NA
3151901	"en_CHN_mopost_int"	"2014-10-03 17:21:05"	"French court jails 'charmer' and 'seducer' for knowingly spreading HIV"	"A French court has sentenced a man described by prosecutors as a ""charmer"" and ""seducer"" to 12 years in prison for knowingly transmitting HIV."	"FRA"	1
3151902	"en_CHN_mopost_int"	"2014-10-03 17:21:05"	"Fake congressman gets close to Barack Obama in new security scare"	"An unidentified man posing as a congressman entered a secure area at US President Barack Obama's appearance at a Congressional Black Caucus Foundation awards dinner in Washington last week, according to a White House official."	"USA"	4
3151903	"en_CHN_mopost_int"	"2014-10-03 17:21:05"	"1920s Kinshasa was ground zero for HIV, gene sequencing shows"	"A ""perfect storm"" of urban change that began in the 1920s in Kinshasa led to the catastrophic spread of HIV across Africa and the world, according to scientists who used genetic sequencing and historical records to trace the origins of the pandemic."	"COD"	1
3151904	"en_CHN_mopost_int"	"2014-10-03 17:21:05"	"US NBC News cameraman tests positive for Ebola in Liberia"	"A US freelance cameraman working for NBC News in Liberia has tested positive for the Ebola virus, the network said, making him the fifth American, known to have contracted the disease in West Africa."	"LBR"	1
3151904	"en_CHN_mopost_int"	"2014-10-03 17:21:05"	"US NBC News cameraman tests positive for Ebola in Liberia"	"A US freelance cameraman working for NBC News in Liberia has tested positive for the Ebola virus, the network said, making him the fifth American, known to have contracted the disease in West Africa."	"USA"	2
3151905	"en_CHN_mopost_int"	"2014-10-03 17:21:05"	"Female stars threaten to sue Google for not removing stolen nude photos"	"A lawyer representing female celebrities whose nude photos were posted online by hackers has threatened to sue Google for failing to take the photos off its websites, according to the New York Post."	"USA"	1
3155352	"en_CHN_mopost_int"	"2014-10-03 23:25:11"	"Don't mention the war: Top Gear flees Argentina after crowd pelts Jeremy Clarkson over 'Falklands' licence plate"	"The presenters of British motoring programme Top Gear fled Argentina after being pelted with stones over a controversial licence plate carried by one of their cars."	"ARG"	1
3155352	"en_CHN_mopost_int"	"2014-10-03 23:25:11"	"Don't mention the war: Top Gear flees Argentina after crowd pelts Jeremy Clarkson over 'Falklands' licence plate"	"The presenters of British motoring programme Top Gear fled Argentina after being pelted with stones over a controversial licence plate carried by one of their cars."	"GBR"	1
3155353	"en_CHN_mopost_int"	"2014-10-03 23:25:11"	"UK leader David Cameron pledges to seek veto over ruling by European court"	"Britain will quit the European Court of Human Rights unless it gives the Westminster parliament final say over its rulings, according to pre-election plans detailed yesterday by Prime Minister David Cameron."	"GBR"	3
3163943	"en_CHN_mopost_int"	"2014-10-04 23:22:00"	"Policy dead ends in China and the US will spawn greater public discontent"	"Both China and the US seem determined to pursue policy dead ends, driven by reaction to events rather than long-term thinking."	"CHN"	1
3163943	"en_CHN_mopost_int"	"2014-10-04 23:22:00"	"Policy dead ends in China and the US will spawn greater public discontent"	"Both China and the US seem determined to pursue policy dead ends, driven by reaction to events rather than long-term thinking."	"USA"	1
3164551	"en_CHN_mopost_int"	"2014-10-05 01:22:03"	"First birth from transplanted womb, to Swedish mum, seen as breakthrough"	"For the world's first baby born to a woman with a transplanted womb, only a victorious name would do. His mother says that is why his parents named him ""Vincent"", meaning ""to conquer""."	"SWE"	1
3164552	"en_CHN_mopost_int"	"2014-10-05 01:22:03"	"Alleged mastermind of US$5 million Stradivarius theft pleads guilty"	"A man accused of masterminding the theft of a US$5 million Stradivarius violin has pleaded guilty to robbery, nearly eight months after the 300-year-old instrument was snatched from a musician who was attacked with a stun gun."	"USA"	1
3164553	"en_CHN_mopost_int"	"2014-10-05 01:22:03"	"Brazil's presidential poll closest in a generation; incumbent Rousseff set to prevail"	"Brazil's presidential elections today are likely to be the closest in a generation, but polls suggest leftist incumbent Dilma Rousseff will secure a second term after a run-off."	"BRA"	2
3164554	"en_CHN_mopost_int"	"2014-10-05 01:22:03"	"Facebook stepping up battle against spammers who sell fake 'likes'"	"Facebook has revealed it has stepped up its battle against spammers who promise to deliver thousands of ""likes"" in return for money and warned users to beware of such scams."	""	NA
3164555	"en_CHN_mopost_int"	"2014-10-05 01:22:03"	"I'd rather not hire a woman who might get pregnant, woman boss says"	"Monica Oriol, the first woman to lead one of Spain's top business associations, was accused of sexism after she said she preferred not to hire women aged between 25 and 45 in case they get pregnant last week."	"ESP"	1
3164556	"en_CHN_mopost_int"	"2014-10-05 01:22:03"	"'Baby Doc' Duvalier, ex-Haitian dictator back from exile, dies"	"Haiti's former dictator Jean-Claude ""Baby Doc"" Duvalier, who ruled the impoverished Caribbean nation from 1971 until his oustnig in 1986, has died of a heart attack at his home."	"HTI"	2
3164557	"en_CHN_mopost_int"	"2014-10-05 01:22:03"	"US air campaign in Middle East proving windfall for arms industry"	"US military companies appear to be benefiting from the new war against Islamic militants in Iraq and Syria. Many analysts foresee a boost to profits for munitions manufacturers, weapons producers and other military contractors."	"IRQ"	1
3164557	"en_CHN_mopost_int"	"2014-10-05 01:22:03"	"US air campaign in Middle East proving windfall for arms industry"	"US military companies appear to be benefiting from the new war against Islamic militants in Iraq and Syria. Many analysts foresee a boost to profits for munitions manufacturers, weapons producers and other military contractors."	"SYR"	1
3164557	"en_CHN_mopost_int"	"2014-10-05 01:22:03"	"US air campaign in Middle East proving windfall for arms industry"	"US military companies appear to be benefiting from the new war against Islamic militants in Iraq and Syria. Many analysts foresee a boost to profits for munitions manufacturers, weapons producers and other military contractors."	"USA"	1
3164558	"en_CHN_mopost_int"	"2014-10-05 01:22:03"	"Syria's Bashar al-Assad makes rare public appearance for Eid prayers"	"Syrian President Bashar al-Assad made a rare public appearance, attending prayers on the Muslim Eid ul-Adha holiday at a mosque in Damascus."	"SYR"	4
